EmployeeId, ThreadID, AlbumID, Id, Title, Url, ThumbnailUrl
966194,1,1,1,accusamus beatae ad facilis cum similique qui sunt,https://via.placeholder.com/600/92c952,https://via.placeholder.com/150/92c952
966194,1,1,2,reprehenderit est deserunt velit ipsam,https://via.placeholder.com/600/771796,https://via.placeholder.com/150/771796
966194,1,1,3,officia porro iure quia iusto qui ipsa ut modi,https://via.placeholder.com/600/24f355,https://via.placeholder.com/150/24f355
966194,1,1,4,culpa odio esse rerum omnis laboriosam voluptate repudiandae,https://via.placeholder.com/600/d32776,https://via.placeholder.com/150/d32776
966194,1,1,5,natus nisi omnis corporis facere molestiae rerum in,https://via.placeholder.com/600/f66b97,https://via.placeholder.com/150/f66b97
966194,1,1,6,accusamus ea aliquid et amet sequi nemo,https://via.placeholder.com/600/56a8c2,https://via.placeholder.com/150/56a8c2
966194,1,1,7,officia delectus consequatur vero aut veniam explicabo molestias,https://via.placeholder.com/600/b0f7cc,https://via.placeholder.com/150/b0f7cc
966194,1,1,8,aut porro officiis laborum odit ea laudantium corporis,https://via.placeholder.com/600/54176f,https://via.placeholder.com/150/54176f
966194,1,1,9,qui eius qui autem sed,https://via.placeholder.com/600/51aa97,https://via.placeholder.com/150/51aa97
966194,1,1,10,beatae et provident et ut vel,https://via.placeholder.com/600/810b14,https://via.placeholder.com/150/810b14
966194,1,1,11,nihil at amet non hic quia qui,https://via.placeholder.com/600/1ee8a4,https://via.placeholder.com/150/1ee8a4
966194,1,1,12,mollitia soluta ut rerum eos aliquam consequatur perspiciatis maiores,https://via.placeholder.com/600/66b7d2,https://via.placeholder.com/150/66b7d2
966194,1,1,13,repudiandae iusto deleniti rerum,https://via.placeholder.com/600/197d29,https://via.placeholder.com/150/197d29
966194,1,1,14,est necessitatibus architecto ut laborum,https://via.placeholder.com/600/61a65,https://via.placeholder.com/150/61a65
966194,1,1,15,harum dicta similique quis dolore earum ex qui,https://via.placeholder.com/600/f9cee5,https://via.placeholder.com/150/f9cee5
966194,1,1,16,iusto sunt nobis quasi veritatis quas expedita voluptatum deserunt,https://via.placeholder.com/600/fdf73e,https://via.placeholder.com/150/fdf73e
966194,1,1,17,natus doloribus necessitatibus ipsa,https://via.placeholder.com/600/9c184f,https://via.placeholder.com/150/9c184f
966194,1,1,18,laboriosam odit nam necessitatibus et illum dolores reiciendis,https://via.placeholder.com/600/1fe46f,https://via.placeholder.com/150/1fe46f
966194,1,1,19,perferendis nesciunt eveniet et optio a,https://via.placeholder.com/600/56acb2,https://via.placeholder.com/150/56acb2
966194,1,1,20,assumenda voluptatem laboriosam enim consequatur veniam placeat reiciendis error,https://via.placeholder.com/600/8985dc,https://via.placeholder.com/150/8985dc
966194,1,1,21,ad et natus qui,https://via.placeholder.com/600/5e12c6,https://via.placeholder.com/150/5e12c6
966194,1,1,22,et ea illo et sit voluptas animi blanditiis porro,https://via.placeholder.com/600/45601a,https://via.placeholder.com/150/45601a
966194,1,1,23,harum velit vero totam,https://via.placeholder.com/600/e924e6,https://via.placeholder.com/150/e924e6
966194,1,1,24,beatae officiis ut aut,https://via.placeholder.com/600/8f209a,https://via.placeholder.com/150/8f209a
966194,1,1,25,facere non quis fuga fugit vitae,https://via.placeholder.com/600/5e3a73,https://via.placeholder.com/150/5e3a73
966194,1,1,26,asperiores nobis voluptate qui,https://via.placeholder.com/600/474645,https://via.placeholder.com/150/474645
966194,1,1,27,sit asperiores est quos quis nisi veniam error,https://via.placeholder.com/600/c984bf,https://via.placeholder.com/150/c984bf
966194,1,1,28,non neque eligendi molestiae repudiandae illum voluptatem qui aut,https://via.placeholder.com/600/392537,https://via.placeholder.com/150/392537
966194,1,1,29,aut ipsam quos ab placeat omnis,https://via.placeholder.com/600/602b9e,https://via.placeholder.com/150/602b9e
966194,1,1,30,odio enim voluptatem quidem aut nihil illum,https://via.placeholder.com/600/372c93,https://via.placeholder.com/150/372c93
966194,1,1,31,voluptate voluptates sequi,https://via.placeholder.com/600/a7c272,https://via.placeholder.com/150/a7c272
966194,1,1,32,ad enim dignissimos voluptatem similique,https://via.placeholder.com/600/c70a4d,https://via.placeholder.com/150/c70a4d
966194,1,1,33,culpa ipsam nobis qui fuga magni et mollitia,https://via.placeholder.com/600/501fe1,https://via.placeholder.com/150/501fe1
966194,1,1,34,vitae est facere quia itaque adipisci perferendis id maiores,https://via.placeholder.com/600/35185e,https://via.placeholder.com/150/35185e
966194,1,1,35,tenetur minus voluptatum et,https://via.placeholder.com/600/c96cad,https://via.placeholder.com/150/c96cad
966194,1,1,36,expedita rerum eaque,https://via.placeholder.com/600/4d564d,https://via.placeholder.com/150/4d564d
966194,1,1,37,totam voluptas iusto deserunt dolores,https://via.placeholder.com/600/ea51da,https://via.placeholder.com/150/ea51da
966194,1,1,38,natus magnam iure rerum pariatur molestias dolore nisi,https://via.placeholder.com/600/4f5b8d,https://via.placeholder.com/150/4f5b8d
966194,1,1,39,molestiae nam ullam et rerum doloribus,https://via.placeholder.com/600/1e71a2,https://via.placeholder.com/150/1e71a2
966194,1,1,40,est quas voluptates dignissimos sint praesentium nisi recusandae,https://via.placeholder.com/600/3a0b95,https://via.placeholder.com/150/3a0b95
966194,1,1,41,in voluptatem doloremque cum atque architecto deleniti,https://via.placeholder.com/600/659403,https://via.placeholder.com/150/659403
966194,1,1,42,voluptatibus a autem molestias voluptas architecto culpa,https://via.placeholder.com/600/ca50ac,https://via.placeholder.com/150/ca50ac
966194,1,1,43,eius hic autem ad beatae voluptas,https://via.placeholder.com/600/6ad437,https://via.placeholder.com/150/6ad437
966194,1,1,44,neque eum provident et inventore sed ipsam dignissimos quo,https://via.placeholder.com/600/29fe9f,https://via.placeholder.com/150/29fe9f
966194,1,1,45,praesentium fugit quis aut voluptatum commodi dolore corrupti,https://via.placeholder.com/600/c4084a,https://via.placeholder.com/150/c4084a
966194,1,1,46,quidem maiores in quia fugit dolore explicabo occaecati,https://via.placeholder.com/600/e9b68,https://via.placeholder.com/150/e9b68
966194,1,1,47,et soluta est,https://via.placeholder.com/600/b4412f,https://via.placeholder.com/150/b4412f
966194,1,1,48,ut esse id,https://via.placeholder.com/600/68e0a8,https://via.placeholder.com/150/68e0a8
966194,1,1,49,quasi quae est modi quis quam in impedit,https://via.placeholder.com/600/2cd88b,https://via.placeholder.com/150/2cd88b
966194,1,1,50,et inventore quae ut tempore eius voluptatum,https://via.placeholder.com/600/9e59da,https://via.placeholder.com/150/9e59da
966194,1,2,51,non sunt voluptatem placeat consequuntur rem incidunt,https://via.placeholder.com/600/8e973b,https://via.placeholder.com/150/8e973b
966194,1,2,52,eveniet pariatur quia nobis reiciendis laboriosam ea,https://via.placeholder.com/600/121fa4,https://via.placeholder.com/150/121fa4
966194,1,2,53,soluta et harum aliquid officiis ab omnis consequatur,https://via.placeholder.com/600/6efc5f,https://via.placeholder.com/150/6efc5f
966194,1,2,54,ut ex quibusdam dolore mollitia,https://via.placeholder.com/600/aa8f2e,https://via.placeholder.com/150/aa8f2e
966194,1,2,55,voluptatem consequatur totam qui aut iure est vel,https://via.placeholder.com/600/5e04a4,https://via.placeholder.com/150/5e04a4
966194,1,2,56,vel voluptatem esse consequuntur est officia quo aut quisquam,https://via.placeholder.com/600/f9f067,https://via.placeholder.com/150/f9f067
966194,1,2,57,vero est optio expedita quis ut molestiae,https://via.placeholder.com/600/95acce,https://via.placeholder.com/150/95acce
966194,1,2,58,rem pariatur facere eaque,https://via.placeholder.com/600/cde4c1,https://via.placeholder.com/150/cde4c1
966194,1,2,59,modi totam dolor eaque et ipsum est cupiditate,https://via.placeholder.com/600/a46a91,https://via.placeholder.com/150/a46a91
966194,1,2,60,ea enim temporibus asperiores placeat consectetur commodi ullam,https://via.placeholder.com/600/323599,https://via.placeholder.com/150/323599
966194,1,2,61,quia minus sed eveniet accusantium incidunt beatae odio,https://via.placeholder.com/600/e403d1,https://via.placeholder.com/150/e403d1
966194,1,2,62,dolorem cumque quo nihil inventore enim,https://via.placeholder.com/600/65ad4f,https://via.placeholder.com/150/65ad4f
966194,1,2,63,facere animi autem quod dolor,https://via.placeholder.com/600/4e557c,https://via.placeholder.com/150/4e557c
966194,1,2,64,doloremque culpa quia,https://via.placeholder.com/600/cd5a92,https://via.placeholder.com/150/cd5a92
966194,1,2,65,sed voluptatum enim eaque cumque qui sunt,https://via.placeholder.com/600/149540,https://via.placeholder.com/150/149540
966194,1,2,66,provident rerum voluptatem illo asperiores qui maiores,https://via.placeholder.com/600/ee0a7e,https://via.placeholder.com/150/ee0a7e
966194,1,2,67,veritatis labore ipsum unde aut quam dolores,https://via.placeholder.com/600/1279e9,https://via.placeholder.com/150/1279e9
966194,1,2,68,architecto aut quod qui ullam vitae expedita delectus,https://via.placeholder.com/600/e9603b,https://via.placeholder.com/150/e9603b
966194,1,2,69,et autem dolores aut porro est qui,https://via.placeholder.com/600/46e3b1,https://via.placeholder.com/150/46e3b1
966194,1,2,70,quam quos dolor eum ea in,https://via.placeholder.com/600/7375af,https://via.placeholder.com/150/7375af
966194,1,2,71,illo qui vel laboriosam vel fugit deserunt,https://via.placeholder.com/600/363789,https://via.placeholder.com/150/363789
966194,1,2,72,iusto sint enim nesciunt facilis exercitationem,https://via.placeholder.com/600/45935c,https://via.placeholder.com/150/45935c
966194,1,2,73,rerum exercitationem libero dolor,https://via.placeholder.com/600/1224bd,https://via.placeholder.com/150/1224bd
966194,1,2,74,eligendi quas consequatur aut consequuntur,https://via.placeholder.com/600/65ac19,https://via.placeholder.com/150/65ac19
966194,1,2,75,aut magni quibusdam cupiditate ea,https://via.placeholder.com/600/a9ef52,https://via.placeholder.com/150/a9ef52
966194,1,2,76,magni nulla et dolores,https://via.placeholder.com/600/7644fe,https://via.placeholder.com/150/7644fe
966194,1,2,77,ipsum consequatur vel omnis mollitia repellat dolores quasi,https://via.placeholder.com/600/36d137,https://via.placeholder.com/150/36d137
966194,1,2,78,aperiam aut est amet tenetur et dolorem,https://via.placeholder.com/600/637984,https://via.placeholder.com/150/637984
966194,1,2,79,est vel et laboriosam quo aspernatur distinctio molestiae,https://via.placeholder.com/600/c611a9,https://via.placeholder.com/150/c611a9
966194,1,2,80,et corrupti nihil cumque,https://via.placeholder.com/600/a0c998,https://via.placeholder.com/150/a0c998
966194,1,2,81,error magni fugiat dolorem impedit molestiae illo ullam debitis,https://via.placeholder.com/600/31a74c,https://via.placeholder.com/150/31a74c
966194,1,2,82,voluptate voluptas molestias vitae illo iusto,https://via.placeholder.com/600/88b703,https://via.placeholder.com/150/88b703
966194,1,2,83,quia quasi enim voluptatem repellat sit sint,https://via.placeholder.com/600/a19891,https://via.placeholder.com/150/a19891
966194,1,2,84,aliquam dolorem ut modi ratione et assumenda impedit,https://via.placeholder.com/600/b5205d,https://via.placeholder.com/150/b5205d
966194,1,2,85,ullam delectus architecto sint error,https://via.placeholder.com/600/eb7e7f,https://via.placeholder.com/150/eb7e7f
966194,1,2,86,qui vel ut odio consequuntur,https://via.placeholder.com/600/fd5751,https://via.placeholder.com/150/fd5751
966194,1,2,87,eos nihil sunt accusantium omnis,https://via.placeholder.com/600/224566,https://via.placeholder.com/150/224566
966194,1,2,88,inventore veritatis magnam enim quasi,https://via.placeholder.com/600/75334a,https://via.placeholder.com/150/75334a
966194,1,2,89,id at cum incidunt nulla dolor vero tenetur,https://via.placeholder.com/600/21d35,https://via.placeholder.com/150/21d35
966194,1,2,90,et quae eligendi vitae maxime in,https://via.placeholder.com/600/bfe0dc,https://via.placeholder.com/150/bfe0dc
966194,1,2,91,sunt quo laborum commodi porro consequatur nam delectus et,https://via.placeholder.com/600/40591,https://via.placeholder.com/150/40591
966194,1,2,92,quod non quae,https://via.placeholder.com/600/de79c7,https://via.placeholder.com/150/de79c7
966194,1,2,93,molestias et aliquam natus repellendus accusamus dolore,https://via.placeholder.com/600/2edde0,https://via.placeholder.com/150/2edde0
966194,1,2,94,et quisquam aspernatur,https://via.placeholder.com/600/cc12f5,https://via.placeholder.com/150/cc12f5
966194,1,2,95,magni odio non,https://via.placeholder.com/600/9cda61,https://via.placeholder.com/150/9cda61
966194,1,2,96,dolore esse a in eos sed,https://via.placeholder.com/600/1fb08b,https://via.placeholder.com/150/1fb08b
966194,1,2,97,labore magnam officiis nemo et,https://via.placeholder.com/600/e2223e,https://via.placeholder.com/150/e2223e
966194,1,2,98,sed commodi libero id nesciunt modi vitae,https://via.placeholder.com/600/a77d08,https://via.placeholder.com/150/a77d08
966194,1,2,99,magnam dolor sed enim vel optio consequuntur,https://via.placeholder.com/600/b04f2e,https://via.placeholder.com/150/b04f2e
966194,1,2,100,et qui rerum,https://via.placeholder.com/600/14ba42,https://via.placeholder.com/150/14ba42
966194,1,3,101,incidunt alias vel enim,https://via.placeholder.com/600/e743b,https://via.placeholder.com/150/e743b
966194,1,3,102,eaque iste corporis tempora vero distinctio consequuntur nisi nesciunt,https://via.placeholder.com/600/a393af,https://via.placeholder.com/150/a393af
966194,1,3,103,et eius nisi in ut reprehenderit labore eum,https://via.placeholder.com/600/35cedf,https://via.placeholder.com/150/35cedf
966194,1,3,104,et natus vero quia totam aut et minima,https://via.placeholder.com/600/313b40,https://via.placeholder.com/150/313b40
966194,1,3,105,veritatis numquam eius,https://via.placeholder.com/600/eaf2e1,https://via.placeholder.com/150/eaf2e1
966194,1,3,106,repellat molestiae nihil iste autem blanditiis officiis,https://via.placeholder.com/600/b1f841,https://via.placeholder.com/150/b1f841
966194,1,3,107,maiores ipsa ut autem,https://via.placeholder.com/600/50d332,https://via.placeholder.com/150/50d332
966194,1,3,108,qui tempora vel exercitationem harum iusto voluptas incidunt,https://via.placeholder.com/600/627495,https://via.placeholder.com/150/627495
966194,1,3,109,quidem ut quos non qui debitis exercitationem,https://via.placeholder.com/600/c5e1ce,https://via.placeholder.com/150/c5e1ce
966194,1,3,110,reiciendis et velit laborum recusandae,https://via.placeholder.com/600/2f9e30,https://via.placeholder.com/150/2f9e30
966194,1,3,111,quos rem nulla ea amet,https://via.placeholder.com/600/cc178e,https://via.placeholder.com/150/cc178e
966194,1,3,112,laudantium quibusdam inventore,https://via.placeholder.com/600/170690,https://via.placeholder.com/150/170690
966194,1,3,113,hic nulla consectetur,https://via.placeholder.com/600/1dff02,https://via.placeholder.com/150/1dff02
966194,1,3,114,consequatur quaerat sunt et,https://via.placeholder.com/600/e79b4e,https://via.placeholder.com/150/e79b4e
966194,1,3,115,unde minus molestias,https://via.placeholder.com/600/da7ddf,https://via.placeholder.com/150/da7ddf
966194,1,3,116,et iure eius enim explicabo,https://via.placeholder.com/600/aac33b,https://via.placeholder.com/150/aac33b
966194,1,3,117,dolore quo nemo omnis odio et iure explicabo,https://via.placeholder.com/600/b2fe8,https://via.placeholder.com/150/b2fe8
966194,1,3,118,et doloremque excepturi libero earum,https://via.placeholder.com/600/eb76bc,https://via.placeholder.com/150/eb76bc
966194,1,3,119,quisquam error consequatur,https://via.placeholder.com/600/61918f,https://via.placeholder.com/150/61918f
966194,1,3,120,eos quia minima modi cumque illo odit consequatur vero,https://via.placeholder.com/600/3ee01c,https://via.placeholder.com/150/3ee01c
966194,1,3,121,commodi sed enim sint in nobis,https://via.placeholder.com/600/fd8ae7,https://via.placeholder.com/150/fd8ae7
966194,1,3,122,consequatur quos odio harum alias,https://via.placeholder.com/600/949d2f,https://via.placeholder.com/150/949d2f
966194,1,3,123,fuga sint ipsa quis,https://via.placeholder.com/600/ecef3e,https://via.placeholder.com/150/ecef3e
966194,1,3,124,officiis similique autem unde repellendus,https://via.placeholder.com/600/bc8f1d,https://via.placeholder.com/150/bc8f1d
966194,1,3,125,et fuga perspiciatis qui quis,https://via.placeholder.com/600/d0882c,https://via.placeholder.com/150/d0882c
966194,1,3,126,id reiciendis neque voluptas explicabo quae,https://via.placeholder.com/600/7ef62f,https://via.placeholder.com/150/7ef62f
966194,1,3,127,magnam quia sed aspernatur,https://via.placeholder.com/600/74456b,https://via.placeholder.com/150/74456b
966194,1,3,128,est facere ut nam repellat numquam quia quia eos,https://via.placeholder.com/600/b0931d,https://via.placeholder.com/150/b0931d
966194,1,3,129,alias mollitia voluptatum soluta quod,https://via.placeholder.com/600/5efeca,https://via.placeholder.com/150/5efeca
966194,1,3,130,maxime provident eaque sapiente ipsa ducimus,https://via.placeholder.com/600/89afb1,https://via.placeholder.com/150/89afb1
966194,1,3,131,qui sed ex,https://via.placeholder.com/600/af2618,https://via.placeholder.com/150/af2618
966194,1,3,132,repellendus velit id non veniam dolorum quod est,https://via.placeholder.com/600/f9a540,https://via.placeholder.com/150/f9a540
966194,1,3,133,placeat in reprehenderit,https://via.placeholder.com/600/f8ee8a,https://via.placeholder.com/150/f8ee8a
966194,1,3,134,eveniet perspiciatis optio est qui ea dolore,https://via.placeholder.com/600/496b8d,https://via.placeholder.com/150/496b8d
966194,1,3,135,qui harum quis ipsum optio ex,https://via.placeholder.com/600/26016b,https://via.placeholder.com/150/26016b
966194,1,3,136,aut voluptas aut temporibus,https://via.placeholder.com/600/2e1c14,https://via.placeholder.com/150/2e1c14
966194,1,3,137,et sit earum praesentium quas quis sint et,https://via.placeholder.com/600/41c3dc,https://via.placeholder.com/150/41c3dc
966194,1,3,138,vitae delectus sed,https://via.placeholder.com/600/ff79d0,https://via.placeholder.com/150/ff79d0
966194,1,3,139,velit placeat optio corrupti,https://via.placeholder.com/600/ff2fe8,https://via.placeholder.com/150/ff2fe8
966194,1,3,140,assumenda sit non debitis dolorem saepe quae deleniti,https://via.placeholder.com/600/c0798a,https://via.placeholder.com/150/c0798a
966194,1,3,141,commodi eum dolorum reiciendis unde ut,https://via.placeholder.com/600/b13ff6,https://via.placeholder.com/150/b13ff6
966194,1,3,142,reprehenderit totam dolor itaque,https://via.placeholder.com/600/c7a96d,https://via.placeholder.com/150/c7a96d
966194,1,3,143,totam temporibus eaque est eum et perspiciatis ullam,https://via.placeholder.com/600/79439b,https://via.placeholder.com/150/79439b
966194,1,3,144,aspernatur possimus consectetur in tempore distinctio a ipsa officiis,https://via.placeholder.com/600/66a752,https://via.placeholder.com/150/66a752
966194,1,3,145,eius unde ipsa incidunt corrupti quia accusamus omnis,https://via.placeholder.com/600/f3472e,https://via.placeholder.com/150/f3472e
966194,1,3,146,ullam dolor ut ipsa veniam,https://via.placeholder.com/600/6c746e,https://via.placeholder.com/150/6c746e
966194,1,3,147,minima aspernatur eius nemo ut,https://via.placeholder.com/600/661f4c,https://via.placeholder.com/150/661f4c
966194,1,3,148,aperiam amet est occaecati quae non ut,https://via.placeholder.com/600/b9d67e,https://via.placeholder.com/150/b9d67e
966194,1,3,149,saepe recusandae ut odio enim ipsa quo placeat iusto,https://via.placeholder.com/600/cffa9b,https://via.placeholder.com/150/cffa9b
966194,1,3,150,ipsum numquam ratione facilis provident animi reprehenderit ut,https://via.placeholder.com/600/3689cd,https://via.placeholder.com/150/3689cd
966194,1,4,151,possimus dolor minima provident ipsam,https://via.placeholder.com/600/1d2ad4,https://via.placeholder.com/150/1d2ad4
966194,1,4,152,et accusantium enim pariatur eum nihil fugit,https://via.placeholder.com/600/a01c5b,https://via.placeholder.com/150/a01c5b
966194,1,4,153,eum laborum in sunt ea,https://via.placeholder.com/600/9da52c,https://via.placeholder.com/150/9da52c
966194,1,4,154,dolorum ipsam odit,https://via.placeholder.com/600/7f330f,https://via.placeholder.com/150/7f330f
966194,1,4,155,occaecati sed earum ab ut vel quibusdam perferendis nihil,https://via.placeholder.com/600/877cd8,https://via.placeholder.com/150/877cd8
966194,1,4,156,sed quia accusantium nemo placeat dolor ut,https://via.placeholder.com/600/11af10,https://via.placeholder.com/150/11af10
966194,1,4,157,nisi odio nihil molestias facere laudantium distinctio facilis et,https://via.placeholder.com/600/211c94,https://via.placeholder.com/150/211c94
966194,1,4,158,qui autem adipisci veritatis iure necessitatibus et ab voluptatem,https://via.placeholder.com/600/5fa928,https://via.placeholder.com/150/5fa928
966194,1,4,159,est ad molestiae ut voluptatum omnis sit consequuntur et,https://via.placeholder.com/600/3587a,https://via.placeholder.com/150/3587a
966194,1,4,160,sequi maiores aut sunt,https://via.placeholder.com/600/170b0e,https://via.placeholder.com/150/170b0e
966194,1,4,161,aliquid aut at sed repudiandae est autem,https://via.placeholder.com/600/739fba,https://via.placeholder.com/150/739fba
966194,1,4,162,et iste aliquam laboriosam et,https://via.placeholder.com/600/2b0599,https://via.placeholder.com/150/2b0599
966194,1,4,163,est eos ducimus consequatur est,https://via.placeholder.com/600/aae0f3,https://via.placeholder.com/150/aae0f3
966194,1,4,164,aut quia enim id neque expedita aliquid,https://via.placeholder.com/600/939eae,https://via.placeholder.com/150/939eae
966194,1,4,165,voluptas dolorem rerum similique quis id unde,https://via.placeholder.com/600/1b5aec,https://via.placeholder.com/150/1b5aec
966194,1,4,166,harum accusamus asperiores,https://via.placeholder.com/600/74c0c4,https://via.placeholder.com/150/74c0c4
966194,1,4,167,et fugit et eius quod provident,https://via.placeholder.com/600/3b4a81,https://via.placeholder.com/150/3b4a81
966194,1,4,168,fugit ad atque excepturi,https://via.placeholder.com/600/e20f7b,https://via.placeholder.com/150/e20f7b
966194,1,4,169,enim asperiores libero ratione voluptatibus alias facilis in voluptatem,https://via.placeholder.com/600/e55524,https://via.placeholder.com/150/e55524
966194,1,4,170,placeat fugit voluptatum cupiditate nemo aut,https://via.placeholder.com/600/e959e4,https://via.placeholder.com/150/e959e4
966194,1,4,171,nemo tenetur ipsam,https://via.placeholder.com/600/3bb51b,https://via.placeholder.com/150/3bb51b
966194,1,4,172,deserunt commodi et aut et molestiae debitis et sed,https://via.placeholder.com/600/d611bd,https://via.placeholder.com/150/d611bd
966194,1,4,173,cupiditate tempore debitis quas quis recusandae facilis esse,https://via.placeholder.com/600/240f8e,https://via.placeholder.com/150/240f8e
966194,1,4,174,assumenda sed deleniti,https://via.placeholder.com/600/44ed94,https://via.placeholder.com/150/44ed94
966194,1,4,175,est ab sed repellendus labore sit modi aperiam,https://via.placeholder.com/600/a06f8a,https://via.placeholder.com/150/a06f8a
966194,1,4,176,aut omnis qui et est molestiae distinctio atque,https://via.placeholder.com/600/d6dc09,https://via.placeholder.com/150/d6dc09
966194,1,4,177,ratione autem magni eveniet voluptas quia corporis,https://via.placeholder.com/600/37942b,https://via.placeholder.com/150/37942b
966194,1,4,178,laboriosam nihil cum provident id quo,https://via.placeholder.com/600/b80430,https://via.placeholder.com/150/b80430
966194,1,4,179,pariatur nesciunt temporibus ipsam ut maiores labore,https://via.placeholder.com/600/a29d32,https://via.placeholder.com/150/a29d32
966194,1,4,180,temporibus aliquam vel et consequuntur minima voluptate sunt,https://via.placeholder.com/600/727ca8,https://via.placeholder.com/150/727ca8
966194,1,4,181,sed animi et sed,https://via.placeholder.com/600/808e8c,https://via.placeholder.com/150/808e8c
966194,1,4,182,non aut facilis nihil aliquid sequi quae aut soluta,https://via.placeholder.com/600/10e0b8,https://via.placeholder.com/150/10e0b8
966194,1,4,183,voluptas necessitatibus ut,https://via.placeholder.com/600/4dc2b9,https://via.placeholder.com/150/4dc2b9
966194,1,4,184,deleniti enim aliquid sequi,https://via.placeholder.com/600/f0d2f4,https://via.placeholder.com/150/f0d2f4
966194,1,4,185,at voluptatem repellat et voluptas eum est ipsum et,https://via.placeholder.com/600/d032c4,https://via.placeholder.com/150/d032c4
966194,1,4,186,incidunt sed libero non necessitatibus,https://via.placeholder.com/600/75999a,https://via.placeholder.com/150/75999a
966194,1,4,187,et aut ad dolor nam,https://via.placeholder.com/600/f63b02,https://via.placeholder.com/150/f63b02
966194,1,4,188,quae accusamus voluptas aperiam est amet,https://via.placeholder.com/600/40bdc9,https://via.placeholder.com/150/40bdc9
966194,1,4,189,esse ad quia ea est dicta soluta perspiciatis,https://via.placeholder.com/600/a75adc,https://via.placeholder.com/150/a75adc
966194,1,4,190,velit quasi incidunt molestiae ut ut ex hic cupiditate,https://via.placeholder.com/600/7dd663,https://via.placeholder.com/150/7dd663
966194,1,4,191,magni fuga alias non consectetur dolorum tempora,https://via.placeholder.com/600/258967,https://via.placeholder.com/150/258967
966194,1,4,192,non deleniti nihil provident eveniet,https://via.placeholder.com/600/70f7e3,https://via.placeholder.com/150/70f7e3
966194,1,4,193,mollitia ut minima totam distinctio provident quia non,https://via.placeholder.com/600/336fe7,https://via.placeholder.com/150/336fe7
966194,1,4,194,aut culpa magni aut officiis,https://via.placeholder.com/600/b98f29,https://via.placeholder.com/150/b98f29
