966194,1,4,195,vel hic et autem quo soluta esse quasi,https://via.placeholder.com/600/973d6d,https://via.placeholder.com/150/973d6d
966194,1,4,196,amet maiores ut,https://via.placeholder.com/600/128151,https://via.placeholder.com/150/128151
966194,1,4,197,nobis ut iusto porro debitis vitae,https://via.placeholder.com/600/d1dd9e,https://via.placeholder.com/150/d1dd9e
966194,1,4,198,libero rem amet ipsam ullam illo excepturi rerum,https://via.placeholder.com/600/43803c,https://via.placeholder.com/150/43803c
966194,1,4,199,nobis sint assumenda consequatur laboriosam laudantium modi perferendis ea,https://via.placeholder.com/600/2da3b7,https://via.placeholder.com/150/2da3b7
966194,1,4,200,perspiciatis est commodi iste nulla et eveniet voluptates eum,https://via.placeholder.com/600/c3f384,https://via.placeholder.com/150/c3f384
966194,1,5,201,nesciunt dolorum consequatur ullam tempore accusamus debitis sit,https://via.placeholder.com/600/250289,https://via.placeholder.com/150/250289
966194,1,5,202,explicabo vel omnis corporis debitis qui qui,https://via.placeholder.com/600/6a0f83,https://via.placeholder.com/150/6a0f83
966194,1,5,203,labore vel voluptate ipsum quaerat debitis velit,https://via.placeholder.com/600/3a5c29,https://via.placeholder.com/150/3a5c29
966194,1,5,204,beatae est vel tenetur,https://via.placeholder.com/600/e4cc33,https://via.placeholder.com/150/e4cc33
966194,1,5,205,fugiat est ut ab sit et tempora,https://via.placeholder.com/600/dc17bf,https://via.placeholder.com/150/dc17bf
966194,1,5,206,possimus expedita ut,https://via.placeholder.com/600/d12649,https://via.placeholder.com/150/d12649
966194,1,5,207,culpa qui quos reiciendis aut nostrum et id temporibus,https://via.placeholder.com/600/a1ff25,https://via.placeholder.com/150/a1ff25
966194,1,5,208,ut voluptatem maiores nam ipsa beatae,https://via.placeholder.com/600/40d9b8,https://via.placeholder.com/150/40d9b8
966194,1,5,209,voluptatibus sit amet vel natus qui voluptatem,https://via.placeholder.com/600/88c71d,https://via.placeholder.com/150/88c71d
966194,1,5,210,et nisi tenetur nam amet sed,https://via.placeholder.com/600/67d26,https://via.placeholder.com/150/67d26
966194,1,5,211,est qui ratione,https://via.placeholder.com/600/918fb8,https://via.placeholder.com/150/918fb8
966194,1,5,212,id exercitationem doloremque vel provident et ea,https://via.placeholder.com/600/9fa1a5,https://via.placeholder.com/150/9fa1a5
966194,1,5,213,sed cum aut,https://via.placeholder.com/600/d2d7f0,https://via.placeholder.com/150/d2d7f0
966194,1,5,214,quis explicabo autem,https://via.placeholder.com/600/511b3c,https://via.placeholder.com/150/511b3c
966194,1,5,215,in magnam praesentium ab illum,https://via.placeholder.com/600/15834f,https://via.placeholder.com/150/15834f
966194,1,5,216,itaque nihil voluptatum,https://via.placeholder.com/600/310675,https://via.placeholder.com/150/310675
966194,1,5,217,ab ut placeat fuga,https://via.placeholder.com/600/4f64e8,https://via.placeholder.com/150/4f64e8
966194,1,5,218,neque placeat dolore assumenda repellat eius ut commodi,https://via.placeholder.com/600/b27684,https://via.placeholder.com/150/b27684
966194,1,5,219,nihil accusantium quos ipsam ut a,https://via.placeholder.com/600/77f823,https://via.placeholder.com/150/77f823
966194,1,5,220,ratione vel quas nostrum et eius est,https://via.placeholder.com/600/53f7dd,https://via.placeholder.com/150/53f7dd
966194,1,5,221,et iusto ratione maiores magnam animi itaque id,https://via.placeholder.com/600/2f27c7,https://via.placeholder.com/150/2f27c7
966194,1,5,222,et molestiae sint voluptas officiis voluptates recusandae laborum et,https://via.placeholder.com/600/dccf6e,https://via.placeholder.com/150/dccf6e
966194,1,5,223,qui beatae ea magnam nulla facilis voluptas,https://via.placeholder.com/600/5a65f7,https://via.placeholder.com/150/5a65f7
966194,1,5,224,omnis asperiores et velit fugit numquam tenetur et,https://via.placeholder.com/600/b273e9,https://via.placeholder.com/150/b273e9
966194,1,5,225,eum magnam expedita velit et vitae autem cupiditate,https://via.placeholder.com/600/21f8c2,https://via.placeholder.com/150/21f8c2
966194,1,5,226,omnis accusantium et,https://via.placeholder.com/600/135ce6,https://via.placeholder.com/150/135ce6
966194,1,5,227,quae facere aut,https://via.placeholder.com/600/3c1e25,https://via.placeholder.com/150/3c1e25
966194,1,5,228,laudantium magnam et culpa dolores harum ipsam,https://via.placeholder.com/600/d8b6fa,https://via.placeholder.com/150/d8b6fa
966194,1,5,229,fugit ut nostrum quia in laborum,https://via.placeholder.com/600/9d3896,https://via.placeholder.com/150/9d3896
966194,1,5,230,a deleniti quae exercitationem aut et reprehenderit,https://via.placeholder.com/600/b24645,https://via.placeholder.com/150/b24645
966194,1,5,231,placeat cumque ea accusamus quo veniam perspiciatis illo,https://via.placeholder.com/600/ea3fb1,https://via.placeholder.com/150/ea3fb1
966194,1,5,232,ea dicta velit dolorem ratione doloribus,https://via.placeholder.com/600/92b48b,https://via.placeholder.com/150/92b48b
966194,1,5,233,nesciunt dignissimos perspiciatis sint veritatis vero facere ipsa id,https://via.placeholder.com/600/5e440,https://via.placeholder.com/150/5e440
966194,1,5,234,qui laboriosam et quae consequatur,https://via.placeholder.com/600/c52dc0,https://via.placeholder.com/150/c52dc0
966194,1,5,235,officiis consequatur necessitatibus id beatae voluptatem in sit dolorem,https://via.placeholder.com/600/72ce88,https://via.placeholder.com/150/72ce88
966194,1,5,236,cumque nihil ullam laborum ut et,https://via.placeholder.com/600/423b8d,https://via.placeholder.com/150/423b8d
966194,1,5,237,vel quam tempore dolor eveniet,https://via.placeholder.com/600/b4e761,https://via.placeholder.com/150/b4e761
966194,1,5,238,aperiam mollitia nisi sed ad magnam repellendus et,https://via.placeholder.com/600/80e9fe,https://via.placeholder.com/150/80e9fe
966194,1,5,239,incidunt aliquid possimus,https://via.placeholder.com/600/c6a0c,https://via.placeholder.com/150/c6a0c
966194,1,5,240,rem neque reprehenderit,https://via.placeholder.com/600/55ccaa,https://via.placeholder.com/150/55ccaa
966194,1,5,241,magni expedita saepe tempore nulla officiis,https://via.placeholder.com/600/af3ad6,https://via.placeholder.com/150/af3ad6
966194,1,5,242,vitae ut sequi explicabo perspiciatis repudiandae omnis et qui,https://via.placeholder.com/600/cc2282,https://via.placeholder.com/150/cc2282
966194,1,5,243,sed nobis consequatur dolores,https://via.placeholder.com/600/ad65d5,https://via.placeholder.com/150/ad65d5
966194,1,5,244,aut doloribus quia unde quia,https://via.placeholder.com/600/2a9243,https://via.placeholder.com/150/2a9243
966194,1,5,245,iusto ut et ea voluptas voluptatum aut eum,https://via.placeholder.com/600/a81869,https://via.placeholder.com/150/a81869
966194,1,5,246,voluptatibus reiciendis ipsa exercitationem saepe quos architecto veniam aperiam,https://via.placeholder.com/600/3a14eb,https://via.placeholder.com/150/3a14eb
966194,1,5,247,ducimus provident possimus,https://via.placeholder.com/600/7f47e7,https://via.placeholder.com/150/7f47e7
966194,1,5,248,doloremque autem similique et beatae cupiditate sed nulla,https://via.placeholder.com/600/c757e5,https://via.placeholder.com/150/c757e5
966194,1,5,249,quia ipsum ut voluptatem saepe nam ipsam beatae,https://via.placeholder.com/600/54c842,https://via.placeholder.com/150/54c842
966194,1,5,250,voluptatem repellendus voluptatibus id occaecati ipsam dignissimos officia,https://via.placeholder.com/600/e33ffb,https://via.placeholder.com/150/e33ffb
